Localización;Fecha;Hora;Nota;Tipo;Velocidad;Camuflaje;Extra
Alabama;2024/03/01;21:00;Estaba jugando con mi oveja favorita en el granero y lo vi;disco;10;sí;15
Aluche;2020/04/17;20:00;Estaba con mis amigos recogiendo flores en el parque;cigarro;20;no;30
Nevada;2022/05/21;23:45;Luces brillantes moviéndose rápidamente en el cielo;luz;15;sí;45
Roswell;2023/06/15;19:30;Objeto redondo con luces intermitentes;disco;25;no;20
Stonehenge;2025/07/10;02:15;Luz que desapareció y apareció varias veces;luz;5;sí;60
Madrid;2021/08/05;18:00;Objeto alargado moviéndose a gran velocidad;cigarro;40;no;50
